Свидетельствуют ли эти слова о том, что сделан первый, маленький реальный шаг в том, что касается Афганистана?
Дмитрий Анатольевич, Вам удалось как-нибудь посмотреть футбол во время саммитов, в том числе матч Англия–Германия? 
Что скажете англичанам? За кого болеете сейчас?
Дмитрий Анатольевич, Вы сейчас упомянули об одной из самых главных тем саммита – это угроза валютных войн.  
На Ваш взгляд, что будет происходить, если всё‑таки события, которые развивались в последнее время, будут развиваться и дальше – и валютные войны всё‑таки начнутся?
Что будет происходить с мировой экономикой, с российской экономикой? 
И, безусловно, всех интересует вопрос, что будет с российским рублём в этой ситуации?
Дмитрий Анатольевич, Вы особо отметили, что следующий саммит «Группы двадцати» будет уже посткризисным. 
В связи с этим, на Ваш взгляд, по итогам этого саммита насколько лидеры вообще проявили готовность договариваться уже в этот посткризисный период? 
Потому что понятно, что, когда был кризис, все, в общем, действовали сообща. 
Что сейчас?
И в этой связи подвопрос. Вчера на бизнес-саммите Вы сказали о том, что дополнительный рост экономике может придать развитие малого и среднего бизнеса. 
Что Россия намерена предпринять в этой связи? 
Какие меры уже приняты и чего стоит ждать? 
И как эту идею восприняли Ваши коллеги?
Дмитрий Анатольевич, невольный вопрос, навеянный тем, что я представляю газету «Коммерсант»: наша газета вчера сообщила о том, что сеть российских разведчиков в США выдал сотрудник СВР полковник Щербаков и что в СВР сейчас идёт масштабное расследование. 
Как Вы думаете, какие результаты могут быть у этого расследования 
в кадровом плане для руководства СВР или в организационном?
Что касается «Базеля-3», как Вам кажется, какое влияние окажет на российскую банковскую систему введение «Базеля-3»? 
Во‑вторых, как Вы относитесь к идее перевести наши банки на международные стандарты финансовой отчётности и отменить наконец российские стандарты бухгалтерского учёта?
Дмитрий Анатольевич, Вы в Сеуле не встречались с Вашими коллегами из стран БРИК?
В ходе дискуссий страны БРИК здесь занимали различные, иногда противоположные позиции, в том числе по поводу количественного смягчения, которое проводит Федеральная резервная система США. 
С Вашей точки зрения, с учётом этих разногласий, каково будущее этой группы, 
и будет ли она каким‑то образом трансформироваться или, может быть, расширяться?
Дмитрий Анатольевич, у меня вопрос по внутренней политике. На прошлой неделе Совет Федерации голосовал по закону, который изменяет процедуру наделения сенаторов полномочиями. 
До этого голосования Сергей Михайлович Миронов написал письмо о том, что он не согласен с этой процедурой. 
Как Вы считаете, чем это вызвано? 
Тем, что Сергей Михайлович очень заботится и переживает по поводу сенаторов, или тем, что он боится, что его полномочий станет несколько меньше? 
И какое Вы видите политическое будущее для Сергея Михайловича Миронова?
Дмитрий Анатольевич, если вернуться к визиту в Корею, обсуждался ли вопрос насчёт транскорейской магистрали? 
Какие политические решения, Вы считаете, необходимо принять для того, чтобы реализовался этот замечательный проект воссоединения транскорейской магистрали?
Да, соединения с Транссибом и так далее. Что Россия может и что она для этого делает в плане сближения двух Корей?
Дмитрий Анатольевич, принято ли сегодня на «двадцатке» консолидированное решение по спасению Греции и еврозоны в целом?
Изменились ли как то российские предложения по поддержке в связи с последними событиями в Греции? 
Недавно называлась цифра 10 миллиардов. 
Сколько готов потратить БРИКС? 
Есть ли согласованная, консолидированная цифра для помощи Греции и еврозоне? Спасибо.
Дмитрий Анатольевич, Вы сегодня на форуме «бизнес-двадцатки» упоминали об авторских правах в интернете, в том числе в Вашем послании к лидерам «двадцатки» на сайте Кремля. 
Интересна реакция партнёров по «двадцатке» на эту тему.
Хотела спросить по поводу ВТО. 
Сейчас идёт противоречивая информация относительно переговорного процесса. 
Хотелось бы узнать, на какие условия, какие предложения согласилась Россия, в том числе, может быть, в части мониторинга товаров, переправляемых через границу.
То есть мы согласны на предложение Швейцарии?
Владимир Владимирович, Вы за эти два дня очень много, наверное, говорили с Вашими партнёрами по сирийской проблеме. 
И многие Ваши партнёры считают, что эту проблему невозможно разрешить без смены режима, так сказать, без ухода Президента Асада. 
Вы неоднократно говорили, что Россия не держится за режим Асада, но необходимо знать ответ на вопрос, что будет дальше, что будет в постасадовской Сирии. 
Наверняка Вы задавали этот вопрос Вашим партнёрам. 
Что они Вам ответили? 
Устраивает ли это видение, которое было выражено Вашими партнёрами, Вас? 
Если устраивает, то готова ли Россия согласиться на уход и на смену режима?
Владимир Владимирович, Вы сказали о 10 миллиардах долларов, которые Россия выделяет Международному валютному фонду. 
Этой же дорогой идут и другие страны 
– выделяется более 400 миллиардов долларов. 
Но, выступая на ряде встреч, выступая в газетах, Вы высказали мысль, что вливание ликвидности – это мера, которая может на каком-то этапе стабилизировать ситуацию, но не является системной. 
Какие системные меры Вы видите для того, чтобы мировую экономику «привести в чувство» и улучшить ситуацию в ней?
Мы тут гадаем, поедете ли Вы на летнюю Олимпиаду в Лондоне. 
Есть разные версии. 
Возможно, Вы обсуждали эту тему с господином Кэмероном. 
Не могли бы сейчас внести ясность? Спасибо.
Владимир Владимирович, звучит, конечно, необычно, но Вы новичок на саммитах «большой двадцатки». 
С другой стороны, это даёт Вам возможность без излишнего политического, дипломатического этикета сказать, что Вам нравится, что не нравится, что надо поменять, тем более что Россия будет возглавлять следующий саммит «большой двадцатки». 
Вы считаете, что можно поменять, а что нужно оставить?
У меня  вопрос о Вашей встрече с Бараком Обамой. 
В последнее время появляются сведения о том
Насколько подробно эта тема обсуждалась во время Вашей беседы с Президентом США, 
и какие доводы Вы привели ему в этом разговоре?
На Ваш взгляд, есть ли у кризиса в еврозоне тенденция к серьёзному ухудшению,
 и не поэтому ли Россия, например, раздумывает о выделении кредита Кипру? 
Вторая часть вопроса: как Вы после совещания «двадцатки», на котором присутствовали, оцениваете действия коллег из Европы по преодолению этого кризиса?
Относительно Ваших переговоров с Обамой. 
Хотела бы уточнить
стоит ли нам рассчитывать на улучшение отношений с США
И будет ли решена такая проблема
Я вчера прочитал Вашу статью, которая была опубликована в мексиканской газете «El Universal». 
В этой статье Вы подчеркнули необходимость улучшения
У меня такой вопрос: кто или какой политик для Вас является моделью? 
В последнее время Вы высоко оцениваете пример реформатора Петра Столыпина.
Как раз в продолжение темы о Бараке Обаме. 
Вы провели много встреч
Отталкиваясь от этого: с кем бы Вы пошли в разведку?
Владимир Владимирович, в Чеченской Республике при всемерной Вашей поддержке, благодаря усилиям Рамзана Кадырова восстановлены города и сёла, социальная сфера. 
Вместе с тем остаётся вопрос промышленности, создания рабочих мест.
Это очень злободневный вопрос сегодня.
И в этой связи хотел бы напомнить, что флагманом чеченской промышленности всегда была нефтяная отрасль, 
а сегодня, как известно, «Роснефть» тормозит строительство НПЗ. 
Скажите, пожалуйста, Вы как Президент можете содействовать восстановлению промышленности, строительству НПЗ? Это первый вопрос, Владимир Владимирович.
И второй вопрос. Владимир Владимирович, лично к Вам обращаюсь. Вы знаете, что в Великую Отечественную войну велась битва за Кавказ, в первую очередь за Грозный. 
Сырьё поставлял тоже Грозный наряду с Баку. 
Грозненцы вместе с другими народами России защищали рубежи на фронтах. 
Мы все эти годы надеялись, что город Грозный получит звание «Город воинской славы», но до сих пор этого не случилось.
К Вам просьба и вопрос, Владимир Владимирович.  Повлияйте, пожалуйста, на эту ситуацию, чтобы кандидатура Грозного беспристрастно была рассмотрена на присвоение почётного звания «Город воинской славы».Спасибо большое.
Владимир Владимирович, наверное, без преувеличения можно сказать, что тень Сирии нависала над нынешним «саммитом двадцати», в то время как по вопросам сугубо экономической повестки дня лидерам удалось найти взаимоприемлемые решения. 
В вопросе, что делать дальше с Сирией, как нам стало известно, мнения разделились примерно поровну. 
В связи с этим хочется спросить: насколько повлияли и могут ли повлиять в дальнейшем политические разногласия на принятие экономических решений? 
И что ждёт в дальнейшем отношения России и Запада?
Владимир Владимирович, хотел у Вас спросить, в итоге получилось ли Вам встретиться с Бараком Обамой, хотя эта встреча не планировалась, но, может быть, на ногах, в неформальной обстановке? 
У многих экспертов и журналистов складывается мнение, что есть определённое разногласие по международной политике у США и России, но отпечаток накладывается из за того, что у Вас с Президентом США не складываются отношения, как то не получается. 
Как в своё время у Вас со Шрёдером были хорошие отношения, а здесь как то не сложились. 
Так ли это? 
Как Вы можете охарактеризовать отношения с Обамой?
Вы только что сказали, что никакого сближения позиций между Вами и Президентом Обамой на встрече не произошло. 
А можете ли Вы сказать, что во время встречи с остальными лидерами чьи то позиции изменились в отношении Сирии хотя бы немного?
Коль у вас была встреча на 20–30 минут, и линии коммуникаций между Вашингтоном и Москвой улучшаются, не входит ли в эти линии коммуникаций возможность обмена Эдварда Сноудена на кого то из российских граждан, которые, как считает российский МИД, несправедливо осуждены в Соединённых Штатах
в первую очередь господин Бут?
А что касается сближения позиций остальных лидеров?
Добрый день, Владимир  Владимирович! Я вернусь, если позволите, к проблеме Сирии. Каковы, по Вашему мнению, возможные последствия возможного удара США по Сирии на Ближнем Востоке, особенно в таких странах, как Египет, где новая власть заявляет о борьбе с терроризмом? 
И вообще, как Вы оцениваете ситуацию в Египте сейчас?
Я редактор газеты «Общество и экология», 14 лет её издаю и смотрю на экономику глазами эколога.
 Хотелось бы Вам сказать, что саммит G20 – это очень важное как с формальной, так и с содержательной точки зрения явление для России и для всего мира, очень важное. 
Он организован очень хорошо, по крайней мере в той части, где мы общаемся с журналистами. 
Я тоже опрашивал наших коллег. 
Мне хочется задать вопрос стратегического характера. 
На саммите много говорят об экономике, о финансах, о деньгах, но не говорят или мало говорят, а для меня, по сути, не говорят, об экологии, об информационной политике, о социальной справедливости, о мировоззрении, а ведь Вы своим указом объявили 2013 год Годом охраны окружающей среды. 
Это явление непосредственно влияет, должно влиять на представителей в том числе и саммита. 
И создаётся впечатление, что на саммите хотят обойти вниманием вопросы экологии и охраны окружающей среды. 
Может даже создаться впечатление, что саммит решает вопросы «мелкого косметического ремонта» капиталистической системы мирового хозяйствования. 
А ведь вся экономика не может вечно рост давать, потому что земля наша не резиновая, когда-то этот экономический рост должен прекратиться. 
Поэтому я хотел бы задать Вам вопрос о Вашем личном видении мировых лидеров: готовы ли они говорить об устойчивом развитии, об экологической безопасности, 
а не только об экономике как таковой? 
Владимир Владимирович, я тоже хочу ненадолго опять вернуться к проблеме Сирии, потому что это всё таки вопрос, который, наверное, по большей части обсуждался за закрытыми дверями. У меня следующий вопрос. 
Вы как то говорили, что Россия ни при каких условиях не будет вмешиваться собственно в военный конфликт в Сирии. 
И в связи с этим: если всё таки военные действия там начнутся, Россия будет помогать Сирии?
Нет, я имею в виду извне. 
Будет ли Россия помогать Сирии? 
По Вашему мнению, в какой ещё стране может возникнуть подобная ситуация, как в Сирии?
Где Вы так простыли? 
Или это были споры до хрипоты?
Вопрос по «зелёной» экономике и энергетике. В связи с принятием решения о консолидации бюджетов повлияет ли это на налоговую политику нашей страны в части предоставления льгот нефтегазовым компаниям на континентальном шельфе, в том числе и арктическом, 
с учётом того, что риски высокие, экономические в первую очередь, и высок риск невозврата этих инвестиций?
А риски для бюджета в итоге колоссальные, конечно. 
Владимир Владимирович, здравствуйте! Телеканал «Дождь». Я хотел бы у Вас спросить про международные отношения в связи с Беларусью, в связи с делом «Уралкалия», Баумгертнером и заочным арестом Сулеймана Керимова. 
Понятно, что мы себя часто сравниваем с Америкой, с Западом. 
В этой ситуации сложно представить, если бы где то на стороне был арестован гендиректор «Кока-колы», что власти долго бы молчали и никак не реагировали. 
С чем связано такое Ваше затишье? 
Пока не было ни одного упоминания по «Уралкалию». 
И разговаривали ли Вы с Лукашенко по этому вопросу? 
Какая у него была реакция? Спасибо.
Вы встретились с Дэвидом Кэмероном. 
Как бы Вы охарактеризовали ваши отношения? 
Есть ли какие то проблемы, препятствия, недопонимание?
Владимир Владимирович, сначала хотел бы поздравить с успешным проведением саммита. У меня два вопроса.
Мы знаем, что вчера Вы встретились с Председателем КНР и свидетельствовали о подписании ряда документов о сотрудничестве. 
Обе стороны выразили готовность к расширению сотрудничества.
 Хотел бы уточнить, каким образом будут укрепляться китайско-российские связи?
И второй вопрос. Мы знаем, что в последние годы в России проходит и пройдёт большое количество крупных мероприятий, таких как форумы, саммиты, АТЭС, «восьмёрка», ШОС, БРИКС, пройдет Олимпиада и чемпионат мира по футболу. 
Хотелось бы уточнить, какие первоначальные намерения у России в проведении стольких крупных мероприятий? Спасибо
