Дмитрий Анатольевич, по-прежнему сохраняется интрига, кто же возглавит МВФ. Хоть в рамках «восьмёрки» этот вопрос не обсуждался, но на двусторонних встречах наверняка этот вопрос поднимался. 
Кто, по Вашему мнению, может стать главой МВФ и собирается ли Россия выдвигать своего кандидата?
Вчера, после встречи с Николя Саркози, Вы заявили о том, что через две недели будет подписан контракт о приобретении французских вертолётоносцев «Мистраль». 
Означает ли это, что Россия получит доступ к западным военным технологиям, 
и не помешает ли это развитию наших военных технологий в постройке новых отечественных кораблей?
Дмитрий Анатольевич, хотелось задать вопрос о российском бизнес-климате. Вы последнее время уделяете ему довольно большое внимание.
Аналитики признали размещение «Яндекса» самым успешным за последнее время, и эксперты связывают это с общим интересом к интернет-компаниям инвесторов. 
На Ваш взгляд, может ли повлиять и насколько может повлиять успех «Яндекса» на интерес инвесторов к России как к высокотехнологичному объекту?
Господин Президент, мы знаем, что Вы обсуждали с партнёрами ситуацию по Сирии. 
Какая позиция России по этому вопросу? 
Правда ли, что Россия – единственная страна из «восьмёрки», которая выступила против новых санкций против Башара Асада?
Дмитрий Анатольевич, помимо кандидатуры главы МВФ нас интересует ещё одна кандидатура. Трудно себе представить, чтобы с Вами не обсуждалась кандидатура будущего главы Совета Федерации.
Кого Вы видите на этом посту?
У меня вопрос по интернету. Как Вы оцениваете итоги заседания, которое вчера было? 
Оно же было очень важным, поскольку оно было первое. 
И какие Ваши инициативы, которые Вы там, насколько я знаю, озвучивали, могут быть приняты международным сообществом в будущем?
Россия признает Палестинское государство в сентябре, если не будет прогресса на переговорах по ближневосточному урегулированию?
Дмитрий Анатольевич, вчера, после встречи с Обамой, было достаточно сенсационное заявление американской администрации о том, что они готовы выплатить пять миллионов долларов, но не за голову, будем так говорить, а за информацию о местонахождении Доку Умарова. 
Вы можете прояснить вообще, о чём идет речь: 
это было запросом российской стороны? 
Это Америка выступила с такой инициативой? 
О чём вообще идёт речь, о каком вознаграждении? Кто, где, кого будет искать?
Дмитрий Анатольевич, вопрос следующий. Ваши коллеги по «большой восьмёрке» интересовались ли у Вас, может быть, как-то приватно или при двусторонних встречах, о Вашем потенциальном участии в выборах Президента 2012 года, и если интересовались, что Вы им ответили?
Как Вы думаете, могут ли Россия и Япония найти общий язык и взаимоприемлемый выбор?
Вопрос по поводу Маргелова. Вы сказали, что направляете его не в Триполи, а в Бенгази. 
И второй вопрос. Вы сказали, что Каддафи должен уйти, а куда он уйдёт?
Россия примет Каддафи?
Дмитрий Анатольевич, «восьмёрка» вновь вернулась к обсуждению экономических мировых проблем, хотя прерогатива была отдана «двадцатке». 
Это значит, что участники «восьмёрки» не доверяют участникам «двадцатки»?
Дмитрий Анатольевич, мы сегодня узнали, что (не сегодня, пару дней назад) Вы освоили новую программу, и из неё узнаем много нового, интересного из Вашей жизни.
В частности, мы узнали, что сегодня Вы на завалинке побеседовали с Президентом США. 
О чём вы говорили? 
Какие вопросы обсуждали?
О чём договорились? 
И как прошла ваша встреча?
Дмитрий Анатольевич, чувствуется ли изменение приоритетов во внешнеполитических вопросах Франции с учётом дебюта Франсуа Олланда (Ф.Олланд – Президент Франции) на саммите? 
И помимо встречи с Бараком Обамой у Вас было достаточно много двусторонних переговоров. 
Хотелось бы услышать их подробности, в частности, пригласил ли Вас Дэвид Кэмерон (Д.Кэмерон – Премьер-министр Великобритании) на Олимпиаду в Лондоне? Спасибо.
Дмитрий Анатольевич, скажите, пожалуйста, каковы результаты обсуждения финансового спасения Европы?
А если подробнее? 
Как будет спасена?
Спасибо большое! Если позволите, к внутренней политике, Дмитрий Анатольевич.
После смены структуры Правительства будут ли меняться или как-то корректироваться планы работы на ближайшие годы? Спасибо!
Вопрос тоже по внутренней политике, если позволите: 
в этот раз время на формирование Правительства у Вас ушло больше. 
С чем это связано? 
И поделитесь, насколько тяжело было подбирать кандидатуры – с учётом того, что Вы объявили, что хотите обновить состав на 70–80%. Спасибо.
Владимир Владимирович, в ходе этой «восьмёрки» большое внимание прессы было уделено общению с Президентом США Бараком Обамой. Вчера мы довольно долго ждали этого события.
Скажите, после обмена посланиями поднимался ли вопрос о ПРО и, может быть, удалось достичь каких-то подвижек в этом направлении?
Владимир Владимирович, о чём Вы договорились с Обамой по Сирии, принимая во внимание тот факт, что США обвиняют Асада в применении химического оружия? 
И ещё в тексте итоговой резолюции сказано, что провести мирную конференцию нужно как можно скорее. 
А может ли такая формулировка стать поводом вообще её не проводить?
Владимир Владимирович, во время саммита мы слушали заявления некоторых политиков, читали местные СМИ.
И складывалось полное ощущение, что Вы один против семи, то ли «семь плюс один», но никак не «восьмёрка» – по крайней мере по сирийскому вопросу. 
Это так, Вы чувствовали себя одиноким?
Владимир Владимирович, кипрская ситуация обнажила проблему офшоров. 
И здесь на повестке дня вроде бы стояли вопросы борьбы с офшорами, 
Вы поднимали неоднократно эту проблему, в том числе в президентском Послании. 
Как, по Вашим ощущениям, существует прогресс в решении этого вопроса?
В продолжение экономической темы, Владимир Владимирович, интересно было бы услышать Ваш комментарий о том, что, как, наверное, Вы знаете, сегодня было объявлено о запуске переговоров между США и Европейским союзом о зоне свободной торговли.
Как Вы оцениваете перспективы, какое влияние – позитивное или негативное – это окажет на Россию?
Владимир Владимирович, Вы уже сказали, что саммит пройдёт в Сочи 3–4 июля…
Это будет новая площадка или уже имеющаяся, которая уже есть для Олимпиады? Или же это будет что-то новое? Это первое.
Второе. Вы уже тоже сказали, что от британского председательства вы некоторые темы в Сочи используете. 
А какие темы ещё будут российские? Какие британские, какие российские?
Владимир Владимирович, Россия регулярно осуждает Запад за планы поставок оружия вооружённой сирийской оппозиции, которая, как Вы сказали уже в Лондоне, отличается иногда особенной жестокостью. 
Тем не менее Россия сама поставляет оружие правительству Асада, которое по факту является одной из воюющих сторон в гражданской войне, где, по оценкам ООН, гибнут тысячи мирных людей. 
В этой связи вопрос: вы планируете продолжать эти поставки и дальше? 
Идут ли они сейчас, каких конкретно вооружений и возможны ли новые контракты? Спасибо.
Владимир Владимирович, недавно в Иране прошли выборы, как раз перед саммитом это было. Вы обсуждали, наверное, и иранскую ядерную проблематику на саммите. 
Вы не могли бы прокомментировать, как может измениться позиция Ирана на международной арене в связи с избранием нового президента?
Были ли сегодня приняты решения по новой мировой финансовой архитектуре 
и насколько эти решения справедливы, с Вашей точки зрения, учитывая, например, и то, что, насколько я понял, сегодня о глобальной резервной валюте речь так и не зашла?
Не задать этот вопрос было бы преступлением. 
Вы встретились с Президентом США Бараком Обамой. 
Вам удалось взглянуть ему в глаза. 
Вы там что нибудь увидели?
Дмитрий Анатольевич, в коммюнике саммита записано, что страны «двадцатки» потратят до конца следующего года пять триллионов долларов на развитие своих экономик. 
Не могли бы Вы сказать, как эта цифра была выработана, 
каким Вы видите вклад России в эту цифру 
и, вообще, давал ли кто то конкретные обещания по цифрам?
Дмитрий Анатольевич, при предыдущем Президенте США во многом проблемы в российско-американских отношениях сглаживались именно благодаря хорошим личным отношениям между лидерами. 
За те полтора часа, которые у Вас были на общение с Президентом Обамой, установились ли у Вас хорошие личные отношения? 
И в дополнение к этому вопросу. Мало было сказано о противоракетной обороне: 
может быть, Вы видите какие то подвижки в этом вопросе?
Дмитрий Анатольевич, все участники саммита согласились с тем, что нужно быть более открытыми, что нужно раскрывать информацию о собственниках компаний, о сделках, о слияниях и поглощениях, в том числе о бонусах и премиях, которые выплачиваются руководству компаний.
 В Америке уже принята инициатива о налогообложении бонусов. 
Может быть, в России подумать о том, чтобы ввести законодательные ограничения на премии и бонусы компаниям, получившим государственную поддержку?
К саммиту «двадцатки» все задавали вопрос: те решения, которые здесь приняты, это начало конца кризиса или это очередной этап подготовки, развития чего то. 
Чего ждать людям? 
Это начало конца кризиса или нет?
Дмитрий Анатольевич, насколько нам известно, Вы сегодня упоминали о проблеме протекционизма на саммите и даже говорили, что Россия готова отказаться от таких мер. 
О чём идёт речь: о мерах, которые уже приняты,
мы откажемся от дальнейшего введения каких либо заградительных пошлин 
или мы будем смотреть на то, как остальные страны ведут себя по этому вопросу?
Добрый день. Дмитрий Анатольевич, Вы уже говорили о том, что приняты решения о некоторой специализации саммита G20, то есть он будет заниматься экономическими проблемами. 
Тогда какие функции остаются у «восьмёрки», 
и насколько строгой будет эта специализация? 
То есть будет ли «восьмёрка» обсуждать экономические проблемы или теперь она будет обсуждать какие то другие, которые не определены?
 И есть ли желание подвёрстывать саммиты «двадцатки» к «восьмёрке»? То есть будут ли они проходить в связке?
Дмитрий Анатольевич, сегодня «двадцатка» приняла ряд важных решений по ограничению бонусов для банковских топ-менеджеров. 
Как эти решения будут реализовываться в России? 
Возможно, будет принят отдельный закон? 
И вообще, на Ваш взгляд, за последние полгода банковские топ-менеджеры стали более скромными?
Кризис показал, что в тупике находится не только мировая экономика. 
А выступление в том числе Барака Обамы на Генассамблее ООН показало, что США, похоже, пытаются воспользоваться конструкцией, когда если ты не можешь противостоять процессу, в данном случае процессу слома однополярного мира, то надо его возглавить. 
В том числе даже по изменению климата, что ещё недавно отрицали Штаты. 
Что из этого, по вашему, может получиться?
И второй вопрос. Насколько я понимаю, вопрос о налоговых гаванях и несотрудничающих юрисдикциях сегодня практически не поднимался. 
Значит ли это, что проблема решена? 
Особенно применительно к России: то, что российские компании, порой даже крупные, работают через оффшоры и принадлежат неизвестно кому, 
– что это значит? 
Это недостаток патриотизма, законодательства или даже совести с их стороны?
Дмитрий Анатольевич, позвольте вернуться к теме Ирана: она сегодня получила новый оборот. 
Скажите, насколько информация о строительстве второго завода стала для Москвы неожиданной,
 и, если к 1 октября Иран не предоставит доказательств того, что их ядерная программа носит мирный характер, на какие шаги Москва готова пойти в этом случае?
Дмитрий Анатольевич, Вы сказали о том, что работа над договором СНВ-2 скорее всего будет завершена в ранее намеченные сроки. 
В связи с этим – не собираетесь ли Вы в конце года вновь посетить США и нанести ответный госвизит? 
И, если можно, поделитесь своими впечатлениями об Америке:  понравилась ли она Вам; 
если да, то чем?
Господин Президент, США изменили свои планы в сфере ПРО в Европе. 
Остаются ли у России планы по размещению ракетных комплексов «Искандер» в Калининградской области в настоящий момент?
Ваша статья «Россия, вперёд!» произвела большой резонанс в России. 
А во время Вашей поездки, общения с иностранными лидерами, экспертами они как то обсуждали идеи этой заметки? 
Вообще, Вам поступают из за рубежа какие то предложения? 
И в чём эти предложения заключаются?
Дмитрий Анатольевич, Вы не очень много сказали про какие то продвижения по мировой финансовой архитектуре на саммите – вот эти обсуждения. 
Может быть, Вы более подробно уточните, какие Ваши предложения поддержаны, какие ещё не поддержаны? Спасибо.
Дмитрий Анатольевич, Вы вчера на встрече со студентами [в Питтсбургском университете] сказали, что у Вас не было каких то сверхъестественных президентских амбиций. 
Сейчас Вы уже год с лишним проработали в должности главы государства. 
Как изменилось Ваше восприятие этой работы? 
И, на Ваш взгляд, какой самый большой плюс в работе Президента 
и самый большой минус?
Если позволите, я к вопросу про МВФ вернусь. 
Вы сказали, что пятипроцентное перераспределение квот – это компромисс.
Вы можете сказать, за этим компромиссом есть какие то фундаментальные экономические показатели или это среднеарифметическое между разными позициями?
И Вы тоже рассказали, что пришло понимание, что кто то должен подвинуться. 
Вы говорили конкретно, кто?
Дмитрий Анатольевич, Вы закончили своё вступительное слово фразой: «Реформы должны продолжаться». 
В связи с этим вопрос. Звучит очень много инициатив в последнее время о новой финансовой валютной системе в мире, 
и наверняка это потребует дальнейшего реформирования Международного валютного фонда, Всемирного банка и прочих системообразующих институтов. 
Как, по-вашему, эти реформы должны проходить 
и в какие сроки? Спасибо.
Дмитрий Анатольевич, не могли бы Вы прокомментировать сообщение по Ирану? 
Директор ЦРУ сказал, что у Ирана сейчас достаточно урана, чтобы создать оружие. 
Есть ли у России такие сведения? 
Как Вы к этому относитесь?
Дмитрий Анатольевич, как Вы оцениваете итоги референдума в Киргизии?
С точки зрения наркотрафика Ваша инициатива по глобальному плану, на мой взгляд, говорит о том, что ситуация катастрофична. 
Наверное, Вы её так оцениваете. 
Тем не менее львиная доля российско-американского заявления по Афганистану была посвящена в том числе наркотрафику. 
