Владимир Владимирович, в Китае и здесь, в Австралии, наверняка же затрагивалась санкционная тематика? 
И если да, то в каком формате это было и в каком ключе: 
на общих заседаниях, может быть, а двусторонках, в коридорах где то?
В интервью накануне саммита «большой двадцатки» Вы сказали о том, что у России на случай резкого ухудшения экономической ситуации есть план действий, в том числе на случай, как Вы сказали, катастрофического падения цен на нефть. 
Не могли бы Вы подробнее рассказать о том, что это за план, в чём он заключается?
И сейчас, в последние дни, довольно бурное обсуждение получила ситуация вокруг компании «Роснефть». 
Некоторые считают абсурдным идею возможного выделения денег этой компании в нынешней непростой экономической ситуации. 
А Вы как считаете? Спасибо.
Вы говорили о периоде турбулентности в мировых делах. 
Есть ли прогнозы, сколько это может продлиться?
Каковы, на Ваш взгляд, итоги этого саммита именно для России, потому что он проходил в довольно сложной внешнеполитической обстановке, в условиях санкций? 
Довольны ли Вы атмосферой на саммите? 
Не было ли у Вас ощущения, что на Вас ваши коллеги пытались оказывать давление в связи с ситуацией на Украине?
Мне бы хотелось, Владимир Владимирович, чтобы Вы всё таки вернулись ещё к Украине более подробно.
Обсуждалась ли Украина в формате конкретно «двадцатки»? 
Если да – в каком контексте? 
Как Вы оцениваете нынешний этап развития ситуации на Украине? 
Нынешний, на мой взгляд, особенно тревожный. Спасибо.
Скажите, пожалуйста, какое Ваше впечатление от общения с господином Эбботом?
Как я понимаю, одной из центральных тем саммита стала борьба с терроризмом. 
Понятно, что без эффективной борьбы против финансирования террористов победить эту проблему не удастся. 
Обсуждались ли какие то конкретные меры на саммите? 
В каком ключе шло обсуждение этих мер? 
До чего в итоге договорились?
Владимир Владимирович, в основе «двадцатки» всегда были экономические вопросы.
Какие из экономических тем, которые Вы обсуждали с лидерами, Вы бы для себя выделили? 
И подвопрос: Вы занимались экономикой и на полях саммита, встречались с главой МВФ. 
О чем вы говорили, 
каковы итоги переговоров 
и в чем суть предложений, которые Вы сделали по долговой проблеме Украины МВФ?
Владимир Владимирович, эксперты много говорили о преемственности повестки турецкого председательства и позапрошлогоднего саммита, который Россия провела в Санкт-Петербурге.
Как Вы считаете, подтвердилась ли эта преемственность?
Очень много разговоров после событий, которые были в Париже, о том, что могут состояться кардинальные изменения, качественные изменения в отношениях между Россией и Западом. 
Как Вы относитесь к этому? 
Вы видели какие нибудь конкретные доказательства тому на ваших сегодня встречах, допустим, с Премьер-министром Великобритании или вчера с Президентом США?
Я, наверное, вернусь к теме терроризма. 
За последний месяц по всему миру прошла серия трагических событий, причём в самых разных точках: взрывы в Багдаде, подготовка к взрывам и терактам в Стамбуле, крушение нашего самолёта (я знаю, да, что нет пока окончательной версии, что это было, но, на взгляд всех экспертов, вероятность теракта исключать нельзя), последние кошмарные взрывы в Париже. 
Франция начала массированную атаку, операцию в Сирии.
Каждый лидер на любой встрече и на каких то общих собраниях здесь говорил о необходимости объединить усилия. 
Как Вы считаете, возможно ли в этих условиях создать действительно единую антитеррористическую коалицию 
и что она из себя должна представлять, 
потому что об объединении усилий говорят все, но при этом никто не говорит, какие у неё должны быть параметры, как она должна выглядеть?
Владимир Владимирович, у Вас на полях саммита состоялась встреча с Реджепом Тайипом Эрдоганом.
Это был ваш первый контакт после выборов в Турции, где Эрдоган и его партия подтвердили статус-кво в политической жизни Турции. 
В связи с этим было ли по итогам этих переговоров Вам сложнее говорить с турецкой стороной, например, про ту же Сирию? 
И что будет с таким проектом, как «Турецкий поток», и другими энергетическими проектами, о которых договаривались дальше?
Хотелось бы вернуться к украинской тематике, тем более Вы вчера встречались с Ангелой Меркель, а Германия входит в нормандский формат. 
Обсуждался ли украинский кризис? 
И нет ли у Вас опасений, что в тот момент, когда мировое сообщество сконцентрировано на теме борьбы с терроризмом, там, на Донбассе, вновь может разгореться конфликт?
Владимир Владимирович, часто можно было слышать, что Ваши западные партнёры обвиняли Россию в том, что российские ВКС в Сирии наносят удары не по ИГИЛ, а по так называемым умеренным группировкам. 
Сейчас в ходе саммита изменилось мнение, 
как Вы почувствовали в ходе дискуссий?
В ходе операции, возглавляемой США против ИГИЛ, ИГИЛ сломить не удалось. 
И вторая часть вопроса. В чём Вы видите в военном отношении разницу между действиями России и действиями коалиции, возглавляемой США? Спасибо.
С момента крушения российского аэробуса прошло достаточно много времени, причём остаются сложности, о которых Вы говорили. 
Когда всё таки можно ждать окончательного вердикта о причинах этой трагедии?
И второе, позвольте. Насколько сегодня, по Вашему, велика угроза повторения того, что случилось в Париже, в российских городах? 
Что делается для минимизации этих угроз? Спасибо.
Владимир Владимирович! В этом году впервые ключевые темы саммита «большой двадцатки» были близки в прикладном плане – темы, которые актуальны для внутриэкономической ситуации. 
Это построение инновационной экономики, доступ к новым технологиям, вообще к технологиям, справедливая торговля, новая финансовая система. 
Не могли бы Вы рассказать, как проходила дискуссия с Вашими коллегами в Ханчжоу по этим темам  
и что это было больше – упражнение в красноречии (как Вы здесь сказали) или же это будет иметь прикладное значение для России?
Япония по‑прежнему является членом «семёрки», 
и как Вы считаете, совместная позиция «семёрки» об Украине может мешать развивать двусторонние отношения с Японией? 
И как Вы оцениваете то, что Премьер-министр Абэ пригласил Вас не в Токио, не в Исашима, а в Ямагути?
Удалось ли Вам продвинуться вперёд по ситуации в Сирии на переговорах с Президентом США?
Ту же тему Вы обсуждали, насколько я понимаю, на переговорах с Президентом Турции. 
Ясны ли для Вас цели Турции в Сирии? 
Не получится ли так, что турецкие войска зайдут на территорию Сирии и там останутся?
Можно я продолжу немножко? 
Был ли для России неожиданным недавний ввод турецких войск в Сирию? 
И у Вас уже вторая за месяц встреча с Президентом Эрдоганом. 
Как Вы в целом оцениваете ход реализации той самой реанимации восстановления двусторонних отношений?
Владимир Владимирович, одна из интересных тем – это встреча на полях саммита с Вашим американским коллегой Бараком Обамой. 
Сирийский трек уже был затронут Вами сейчас, вы ещё обсуждали Украину. 
Какие ещё темы вы обсуждали?
Как вообще прошла встреча? 
Затрагивалась ли какая‑то санкционная тематика? 
Вот об этом событии расскажите, пожалуйста.
Владимир Владимирович, разрешите уточнить по взаимоотношениям с Японией. 
На пленарном заседании во Владивостоке Синдзо Абэ довольно эмоционально, перейдя даже на «ты», призывал Вас принять историческое решение, взять на себя ответственность. 
Имелась в виду, безусловно, территориальная проблема. 
У обеих сторон разные взгляды.
Когда вы обсуждали, что хочет Япония и на что готова пойти Россия? 
Где эта «красная линия» в отношении Южных Курил?
Владимир Владимирович, по БРИКС хотелось бы вопрос задать.
Вот в этом формате встречались сейчас на полях «двадцатки». 
Стабильные ситуации в экономике и в политике в странах БРИКС, но есть исключения, если говорить, в частности, о Бразилии.
В этой связи комфортно ли сейчас общаться, планировать что‑то на будущее, обсуждать какие‑то важные моменты?
С чем мы едем в Индию? 
И какова, собственно, повестка будет? 
И, поскольку такое немножко неформальное общение, чуть-чуть к Обаме позвольте вернуться.
Говорилось о том, что он инициативу проявил встретиться с Вами. 
Когда он проявил эту инициативу? 
На каком этапе вчерашнего дня он подошёл к Вам и предложил встретиться? 
И когда сегодня Вы выходили из зала, Вы посмотрели на часы, – говорит ли это о том, что пообщаться удалось дольше, чем предполагалось? 
И продуктивнее, может быть?
По БРИКС?
Вы встречались вчера с новым Премьер-министром Великобритании Терезой Мэй. 
Каковы результаты этой встречи, Ваши впечатления от неё? 
И как Вы считаете, есть ли перспективы на нормализацию отношений между двумя странами, 
и если есть, то какие?
Владимир Владимирович, если позволите, в продолжение других двусторонних Ваших переговоров.
Все ждали, по крайне мере, мы, журналисты, сегодня на этом саммите, что Вы проведёте трёхсторонние переговоры с главами Франции и Германии. 
Но, как я понимаю, по их инициативе были проведены отдельные встречи.
Главной темой, естественно, наверное, была Украина.
О чём удалось договориться?
 И вообще, раз уж если вы по отдельности Украину обсуждали, каково будущее у «нормандского формата»?
И Вы будете общаться с Порошенко?
Владимир Владимирович, позвольте про Саудовскую Аравию и про Ваши переговоры с бен Сальманом.


Вы обсуждали, я так понимаю, и Сирию, и какие‑то военные вопросы. 
И в то же время точно много говорили про нефть, потому что сегодня было объявлено о некоем соглашении между Россией и Саудовской Аравией. 
Я говорю «некое», потому что там нет всё‑таки конкретных параметров, просто говорится о том, что две стороны собираются вместе сотрудничать для балансировки нефтяного рынка. 
 Но хотелось в этой связи про нефть чуть конкретней у Вас уточнить
Саудовцы всё‑таки говорят, что пока заморозка не нужна, а Вы считаете, что она нужна.
Да. Министр был на брифинге. 
Мы как бы говорим о том, что заморозка – наиболее идеальный способ решения проблем балансировки цен на мировом нефтяном рынке, саудовцы говорят, что пока этого делать не надо. 
Всё‑таки когда это должно быть сделано, 
должно ли это быть сделано, 
какого уровня цены на нефть Вы хотите достигнуть за счёт этого соглашения, которое сегодня заключило с Саудовской Аравией Министерство [энергетики] России?
И второй момент. После нефти ответьте ещё немножко про Сирию. 
Всё‑таки конкретно вопросы военного сотрудничества с Саудовской Аравией и с Обамой Вы проговаривали, 
и то соглашение с США по Сирии, по которому Вы говорите, что, возможно, будет достигнуто, насколько амбициозно, 
позволит ли оно к совместным военным действиям, например, в Сирии привести?
Она сейчас справедливая?
Саммит «двадцатки» показал, что, собственно, у всех стран есть экономические и политические проблемы, и Россия не исключение. 
Но часто так бывает, что, действительно, сложнейшие проблемы решаются на человеческом уровне, когда лидеры исчерпывают возможности для восстановления диалога, а как‑то на простом уровне проблемы начинают решаться. 
Пример Эрдогана, например: 
тоже такая история была, когда человек погорячился и дал понять, что он погорячился, сдал немножко назад, и теперь отношения с Турцией восстанавливаются.
Великобритания. Тоже вроде бы ничего не изменилось, но сменился лидер, и есть шанс теперь на восстановление.
Но хочется к Обаме опять же перейти – ключевой партнёр и всё такое.
Есть, может быть, что‑то такое, что если бы Обама сказал: «Я в этом месте погорячился», – может быть, секторальные санкции, может быть, персональные. 
Что‑то, может быть, Вас как‑то задело, показалось несправедливым? 
Если бы он как‑то по‑человечески, не как лидер страны, сказал: «Да, я тут немножко перегнул»
Здравствуйте! Как Вы оцениваете вклад Китая в развитие мировой экономики
и механизм работы «большой двадцатки»?
Скажите, обсуждалась ли проблема создания де-факто закрытых объединений, таких, как трансатлантическое торговое инвестиционное партнёрство, транстихоокеанское партнёрство? 
На Ваш взгляд, проведение встреч, например в формате «двадцатки», насколько это эффективно, если ряд стран всё равно действуют по своим собственным правилам?
И в таких условиях, на Ваш взгляд, насколько Россия готова к конкуренции на глобальном рынке в таких непростых экономических условиях?
А что касается готовности к конкуренции…
Владимир Владимирович, возвращаясь к сотрудничеству с Китаем. 
И на площадках саммита, и в кулуарах, и перед его началом фигурировала не раз тема касательно Гаагского суда относительно Южно-Китайского моря. И не раз эти территориальные споры комментировал и Президент США Барак Обама, ещё до приезда на саммит, и китайская сторона, глава КНР Си Цзиньпин давал свой комментарий. 
И не раз эти территориальные споры комментировал и Президент США Барак Обама, ещё до приезда на саммит, и китайская сторона, глава КНР Си Цзиньпин давал свой комментарий.
Какова позиция России по этому вопросу? 
Хотелось бы услышать Ваше мнение. 
И особый интерес, конечно, вызывают российско-китайские учения «Морское взаимодействие», которые пройдут как раз в акватории Южно-Китайского моря.
Владимир Владимирович, про доверительные отношения можно ещё? 
Си Цзиньпин попробовал мороженое? 
Понравилось ли оно ему?
Какое мороженое?
Один вопрос, не связанный с саммитом, но который обсуждается последние дни. 
После смерти Ислама Каримова выдвигаются различные версии по поводу развития ситуации в Узбекистане. 
Каков Ваш прогноз, как будут развиваться отношения Москвы и Ташкента в ближайшее время? 
Нет ли у Вас опасений?
Владимир Владимирович, известно, что как эксперты, так и рядовые граждане, часть из которых сейчас буянит, протестует неподалёку от этого здания, по-разному оценивают полезность саммитов «двадцатки». 
На этом, например, больше разговоров было о Вашей встрече с Трампом. 
Тем не менее какая тема, которую обсуждала нынешняя «двадцатка», по Вашему мнению, самая актуальная для России? Спасибо.
Владимир Владимирович, я продолжу тему моего коллеги. 
Хотя политических вопросов на саммите было много, они всё больше и больше на «двадцатке» появляются, тем не менее Вы перечисляли экономические темы, они всё же в приоритете. 
Многие выступающие, министры разных стран, отвечающие за экономику, говорили о том, что 2017 год может стать годом роста мировой экономики. 
