Владимир Владимирович, накануне встречи много говорили о том, что тема национальной ПРО может стать своего рода раздражителем для участников «восьмерки». 
Как после завершения мероприятия Вам видится: были разговоры на эту тему или их не было?
Вы стали «звездой» форума. 
Канцлер ФРГ Герхард Шредер заявил, что Россия должна стать полноправным участником «большой восьмерки». 
Какой Вы видите роль России в «большой восьмерке» в будущем?
Известно, что политические лидеры, с которыми Вы вели переговоры, одобрительно восприняли результаты Вашего визита в Северную Корею.
У Вас есть ощущение, что руководители развитых стран мира действительно готовы разделить всю полноту риска и ответственности, скажем, за начавшийся процесс интеграции Северной Кореи в мировое сообщество? 
Или это останется таким российским «фирменным блюдом»?
Владимир Владимирович, скажите, пожалуйста, как Ваше участие в этой встрече отразится на внутренней жизни России? 
Это все внешняя сторона, в том числе Ваше общение с лидерами, которые здесь были. 
А как это применимо к общественно-политической жизни России, к Вашему имиджу как главы государства внутри нее?
Владимир Владимирович, скажите пожалуйста, куда Вы собираетесь поехать после Окинавы 
и что Вы намерены делать там, куда Вы собираетесь поехать?
Какое у Вас осталось впечатление от встречи с господином Жаком Шираком?
Владимир Владимирович, известно, что не только Россия, но и многие союзники США, в частности Франция и Германия, критически относятся к планам США по развертыванию ПРО.
На Ваш взгляд, после Вашего визита в Северную Корею и после тех встреч, которые Вы провели здесь, изменится ли это отношение
станет ли это противодействие планам ПРО со стороны союзников США еще более сильным?
Многим известны Ваши оценки Ким Чен Ира. 
Можно ли сказать, что ваш визит в КНДР свидетельствует о радикальных переменах в политике? 
Подлинная ли это смена курса? 
Какие мотивы кроются за всем этим?
Владимир Владимирович, Ваши общие впечатления от саммита 
и какие наиболее важные для России, на Ваш взгляд, вопросы обсуждались сегодня на первом рабочем заседании?
В рамках саммита Вы уже провели четыре двусторонние встречи: с Федеральным канцлером ФРГ, премьер-министрами Великобритании, Японии и Италии. 
Каковы Ваши впечатления от этих встреч 
и что Вы ожидаете от завтрашней встречи с Джорджем Бушем?
В каком ключе Вы обсуждали ситуацию на Балканах, в частности в Македонии, 
и как Вы оцениваете перспективы ее развития?
Владимир Владимирович, подводя итоги саммита, 
какие положения из принятых заявлений о глобальном партнерстве Вам представляются наиболее важными, в частности для России? 
Были приняты три заявления. Что, по Вашему мнению, в них является важнейшим?
Обсуждался ли на саммите вопрос о проведении внеочередного саммита «восьмерки» в Петербурге в 2003 году? 
Если поднимался, то каковы результаты обсуждения?
Каковы итоги сегодняшней двусторонней встречи с Джорджем Бушем?
Могли бы Вы прокомментировать те решения, которые были приняты сегодня по террору, 
и были ли какие-то разногласия между странами – участницами «восьмерки» при обсуждении этого вопроса?
Не могли бы Вы еще раз прояснить, что для России является самым важным из итогов этого саммита? 
И второй вопрос: Вы высоко оценили то, как был организован саммит здесь, в 2006 году он будет проходить в России. 
Думали ли Вы где?
Вы два дня провели в этом прекрасном месте. 
Скажите, какие человеческие чувства Вы испытываете, 
что Вам понравилось больше всего, 
с каким чувством Вы будете отсюда уезжать?
На недавней встрече с журналистами Вы сказали, что Ясира Арафата нельзя исключать из процесса ближневосточного урегулирования. 
Президент Буш, напротив, здесь говорил об обратном. 
Говорит ли это о том, что между Москвой и Вашингтоном возникли разногласия по ближневосточной проблематике, 
возможно, Вам здесь удалось найти точки соприкосновения по данной теме?
Что касается Африки. 
«Восьмерка» творчески подошла к плану, предложенному африканскими странами. 
Какое здесь участие России, ее роль, место, может быть, даже в глобальной проблеме – борьбе с бедностью?
Как Вы относитесь к антиглобалистам? 
Не кажется ли Вам, что есть что-то несуразное в том, что «восьмерка» забирается все выше в горы для того, чтобы решать проблемы глобального характера, а количество людей, возражающих против этого, становится все больше. 
Каковы пути диалога между этими двумя сторонами?
Какая часть из 20 миллиардов, выделенная на ликвидацию оружия массового уничтожения, будет выделена России, а какая часть – другим странам СНГ? 
Если можно, назовите эти страны. 
И решено ли уже, под какие объекты будут выделяться эти деньги?
Как бы Вы оценили результаты саммита, 
что можно выделить, 
что удалось сделать?
Завершен недельный международный марафон. 
Можете ли Вы, по итогам общения с десятками глав государств, сказать, что меняется в отношении к России?
Как представляется, в эти дни, после саммита ШОС, серии крупных международных встреч в Санкт-Петербурге и Эвиане, формируется новая иерархия мира, и Россия в ней – на привилегированном положении. ду?
Но есть, с другой стороны, США, которые стоят особняком и действуют в одиночку. 
Что Вы можете сказать по этому поводу?
Что Вы можете сказать о ситуации с иранской ядерной программой?
Принята резолюция ООН. 
Эта тема активно обсуждалась и будет обсуждаться. 
Что дальше с этой проблемой 
– не с точки зрения «бумажного» решения, а на практике?
Каково отношение России к идее Большого Ближнего Востока? 
Что это за новое географическое понятие – ББВ? 
С точки зрения внешней политики, интерес России в участии в «большой восьмерке» неоспорим. 
Но с точки зрения внутренней политики – что дает «восьмерка» России?
Глобальное партнерство – это миф или реальность? 
Будет когда-нибудь практическая отдача?
Некоторая часть экспертов считает, что идея «восьмерки» изжила себя: принимаются необязательные решения. 
Как Вы к этому относитесь?
Как Вы относитесь к предложениям некоторых Ваших коллег пригласить к работе в «восьмерке», в частности Китай, Индию? 
Это реально?
У Вас не было официальной встречи с временным президентом Ирака. Но удалось ли Вам с ним встретиться, поговорить?
Что касается Ирана, то за последний год наблюдалось сближение российско-американской позиции, все больше настороженность по поводу того, что происходит в Иране. 
Тем не менее Россия не отказывается пока от строительства электростанции в Бушере. 
В каком формате поднимался этот вопрос на встрече с Джорджем Бушем? 
И есть ли условия, при которых Россия может отказаться от работы в Бушере? 
Япония готовится к следующему юбилейному году – году юбилея Симодского договора, который установил дипломатические отношения между нашими странами и впервые определил границы. Ваш визит в Японию совпадает с этим юбилеем.
Это случайное совпадение или нет? 
И как это совпадение повлияет на содержание Вашего визита?
Не могли бы Вы рассказать немного о неформальной атмосфере 
– не о той, когда Вы встречались за круглым столом. 
Мы видели, Вы гуляли по острову с Шредером и Шираком. 
Не было ли там больше взаимопонимания между одними и меньше – между другими?
Я беседовал с представителями американской администрации, которые мне сказали, что господин Буш поднял вопрос свободной прессы в России. 
Каков был Ваш ответ?
Хочу вернуть Вас к экономике и политике. Америка предлагает списать долги Ирака.
Ирак нам должен значительную сумму. 
Может быть, здесь что-то можно сделать в одностороннем порядке, без участия членов «восьмерки»?
Как Ваши коллеги по «восьмерке» оценивают продвижение России к вступлению в ВТО? 
Вы обсуждали эту тему?
В одном из документов саммита есть специальный пункт, в котором говорится, что «восьмерка» приветствует прогресс, достигнутый Россией перед вступлением в ВТО, и он отражает тот консенсус, который сложился в организации.
Через два года Россия станет председателем «восьмерки». Но работа начинается уже сейчас. 
Есть какие-то планы, где будете принимать своих друзей? 
Россия будет выдвигать в связи с этим событием какие-то новые идеи?
В связи с появившимися во время работы саммита разными публикациями в американской прессе о том, что Россия якобы не достойна быть членом «восьмерки», 
можно ли сейчас считать Россию прочно утвердившимся членом «восьмерки»?
Американский Президент на одной из двусторонних встреч сказал, что было бы очень неплохо, если бы парни из НАТО взялись за помощь иракскому народу. 
В принципе эта идея противоречит идее, что помогать должны парни из ООН. 
Эта новость сразу стала первополосной, с нее начинались телевизионные выпуски. 
Что Вы думаете по этому поводу?
Вас пригласили на похороны Рональда Рейгана и на 80-летие Буша-отца? 
И было ли выпито за помин души первого и за здоровье другого?
Устали? Искупаться удалось?
Что вообще запомнилось – Вы проделали огромный путь, такой марафон: 24 тысячи километров – Нормандия, Мексика?
Вы проделали огромный путь, такой марафон: 24 тысячи километров – Нормандия, Мексика?
Гастрономически что больше всего запомнилось?
Вы пригласили всех своих коллег на 60-летие Победы?
По Вашим ответам заметно, что Ваша философия – это все же достижение единства, а не игра на противоречиях. Правильно?
Вопрос о терроризме. Вы вчера сказали, что с терроризмом нужно бороться совместно и беспощадно. 
В нашем обществе – и среди политиков, и в массах – все-таки существуют антиамериканские и антизападные настроения. 
Влияют ли они на усилия по борьбе с терроризмом, 
ослабляют ли их?
Когда стало известно о взрывах в Лондоне, возникла ли реальная опасность, что саммит будет сорван? 
Сейчас мы видим, что этого не произошло. 
По Вашему мнению, не был ли он скомкан, 
удалось ли в полной мере раскрыть все те вопросы, которые планировалось?
Какой вопрос был наиболее острым и дискутируемым в ходе ваших рабочих заседаний? 
Конечно, работа была не только в комнатах, за общим столом. Вы, наверное, общались со многими лидерами и в кулуарах. 
О чем шла речь в ходе этих бесед? 
Какая была атмосфера? Как Вы ее можете оценить?
Добрый день. Я о наболевшем хочу сказать…
Да. Наболело очень сильно. Как Вы относитесь к тому, что саммит «восьмерки» абсолютно закрыт с точки зрения информации? 
Мы в шоке: работаем в нескольких минутах ходьбы от отеля, и все эти три дня ничего не видим из того, что происходит. 
Это нормально? Спасибо.
Вчерашний чудовищный теракт в Лондоне заставил многих людей задуматься о дополнительных мерах по борьбе с терроризмом. 
Может ли эта борьба с терроризмом ожесточить цивилизованный мир? 
И, в свою очередь, может ли это привести к тому, что будут поставлены под сомнение сами основы демократии, внутренней демократии?
Вы объявили, что следующая «восьмерка» пройдет в Санкт-Петербурге. 
Почему именно Санкт-Петербург? 
Как отнеслись к этому Ваши коллеги, 
какие основные темы будут на этом саммите?
Обсуждалось ли на нынешнем саммите расширение формата «восьмерки»?
На сколько процентов Россия может увеличить поставки нефти странам «восьмерки» 
и за какой период времени?
Как известно, «большая восьмерка» – это в основном продукт личной дипломатии. 
Расскажите, пожалуйста, о личных отношениях внутри «восьмерки». 
Например, окончательно ли закончился, по Вашему мнению, период некоторого охлаждения отношений со времен Ирака? 
Существуют ли, например, в «восьмерке» какие-то внутренние особо теплые союзы? 
Как личные отношения могут влиять на межгосударственные отношения в целом?
Два года назад Вы поставили цель удвоить ВВП в течение десяти лет. 
Учитывая серьезные разногласия в Правительстве по этому поводу и учитывая также замедление темпов роста, считаете ли Вы сейчас эту цель реальной?
Несмотря на то что у Вас не было отдельной двусторонней встречи с Президентом США, Вы наверняка успели пообщаться. 
Не могли бы Вы рассказать о темах, которые сочли нужным затронуть в первую очередь?
Не секрет, что Россия не самая богатая страна в мире. 
Выигрываем ли мы что-нибудь от помощи африканским странам?
Почему Вы решили определить дату встречи с Дзюнъитиро Коидзуми, несмотря на то что существуют разногласия по территориальному вопросу? 
Какие у Вас ожидания от этого визита? 
Что, по-вашему, нужно сделать, чтобы заключить мирный договор?
Многие политики нелестно отзываются о деятельности кабинета Михаила Фрадкова. 
Вас устраивает работа Правительства? 
Как Вы относитесь к тому, что возникают личные конфликты между премьером и его подчиненными?
Накануне в Казахстане члены ШОС договорились о том, чтобы попросить членов антитеррористической коалиции подумать о сроках вывода своих баз с территории Средней Азии. 
Обсуждалась ли эта проблема здесь? 
Прощупывали ли Вы настроения своих коллег по коалиции и в какие сроки Вы хотели бы вывода баз с этой территории?
В документах, подписанных в Астане, значится, что страны ШОС будут вырабатывать новые механизмы реагирования на чрезвычайные ситуации. 
О чем идет речь: 
о каких-то информационных обоймах или же в будущем могут проводиться совместные военные операции?
В прессе прошли сообщения о заинтересованности «Газпрома» в покупке «Сибнефти», а уже в Астане «Роснефть» заявила о заинтересованности в активах «Сибнефти», так как это крупнейший актив. 
Существует ли по этому вопросу позиция государства?
Владимир Владимирович… Очень волнительно. Извините, пожалуйста, за такую заминку.
Решения, которые принимаются «большой восьмеркой», затронут всех… И обязательно молодежь, поколение «юношеской восьмерки». 
Скажите, чего нам ждать?
Владимир Владимирович, какие «горячие» вопросы Вы будете обсуждать с Председателем Ху Цзиньтао?
И второе: от многих-многих китайцев Вам привет, Вы наш настоящий герой. Спасибо.
Владимир Владимирович, у меня такой вопрос: последние события, в том числе и в Ливане, и вообще, если взять прошедший год, два последних года, показывают, что мир накопил значительный конфликтный потенциал. Ежедневно в конфликтах гибнут сотни людей. Мы все это видим по телевизору, и всем все понятно. 
Причем старые конфликты, они как бы затухают, но проблема не решается, появляются новые. И складывается впечатление, что существующая система решения и предупреждения конфликтов не работает. Я имею в виду в глобальном плане, в мировом. 
И, более того, получается, что и система организации международных отношений зашаталась. 
